{
  "schema": "dusk.process-output/v1",
  "id": "01a112fe-d1bd-704c-9bd1-233b3465b74c",
  "time": "2026-10-06T09:15:51.512408228Z",
  "pid": "13792273858822192861",
  "campaign_id": "0192f3a4-5b6c-7d8e-9f01-23456789abcd",
  "device_id": "3f9c0e2a7b5d4c1e8a6f0b2d9e7c5a13",
  "installation_id": "a41e6c2f9b0d4e7a8c3f5b1d2e9a6c70",
  "namespace_id": "5d2e9a1c7b3f8e04",
  "index": 1,
  "value": {
    "0x9c2f1a7e5b3d0846": {
      "pid": 12,
      "name": "nightfall",
      "status": "running"
    }
  },
  "truncated": false
}
